{
  "schema_version": "6",
  "kind": "code-units",
  "repo_key": "cli_repo",
  "snapshot_id": "<SNAPSHOT_ID>",
  "scope": "repogpt:cli_repo",
  "replace_scope": false,
  "stats": {
    "total_files": 3,
    "ok_files": 2,
    "failed_files": 1,
    "emitted_documents": 7
  },
  "failures": [
    {
      "record_type": "failure",
      "schema_version": "6",
      "path": "bad.py",
      "language": "py",
      "error": "File \"bad.py\", line 1\n    def broken(:\n               ^\nSyntaxError: invalid syntax",
      "file": {
        "size": 13,
        "sha256": "e5c39b5d9e483c96898f2970978fee4d8e5a3814e685d9ab37365a5aa333b5ad"
      }
    }
  ],
  "documents": [
    {
      "external_id": "repogpt:cli_repo:sample.md:module",
      "source_id": "repogpt:cli_repo:file:sample.md",
      "repo_key": "cli_repo",
      "scope": "repogpt:cli_repo",
      "snapshot_id": "<SNAPSHOT_ID>",
      "path": "sample.md",
      "language": "md",
      "unit_type": "module",
      "unit_level": "container",
      "symbol": "sample",
      "qualified_name": "sample.md",
      "container_id": "repogpt:cli_repo:sample.md:module",
      "depth": 0,
      "ancestor_path": [],
      "start_line": 1,
      "end_line": 9,
      "content": "",
      "content_hash": "e3b0c44298fc1c149afbf4c8996fb92427ae41e4649b934ca495991b7852b855",
      "docstring_present": false,
      "has_children": true,
      "metadata": {
        "file": {
          "size": 88,
          "sha256": "5a87f3df70d35798225f6704cd76e098ec06f4e69833e8a77054120456e5b79c"
        },
        "tags": [
          "TODO"
        ],
        "attributes": {}
      },
      "content_ranges": []
    },
    {
      "external_id": "repogpt:cli_repo:sample.md:heading:demo",
      "source_id": "repogpt:cli_repo:file:sample.md",
      "repo_key": "cli_repo",
      "scope": "repogpt:cli_repo",
      "snapshot_id": "<SNAPSHOT_ID>",
      "path": "sample.md",
      "language": "md",
      "unit_type": "heading",
      "unit_level": "container",
      "symbol": "Demo",
      "qualified_name": "demo",
      "container_id": "repogpt:cli_repo:sample.md:module",
      "depth": 1,
      "ancestor_path": [
        "sample.md"
      ],
      "start_line": 1,
      "end_line": 9,
      "content": "# Demo\n\n<!-- TODO: document -->\n\n[Docs](https://example.com)\n\n```python\nprint(\"ok\")\n```\n",
      "content_hash": "5a87f3df70d35798225f6704cd76e098ec06f4e69833e8a77054120456e5b79c",
      "docstring_present": false,
      "has_children": true,
      "metadata": {
        "file": {
          "size": 88,
          "sha256": "5a87f3df70d35798225f6704cd76e098ec06f4e69833e8a77054120456e5b79c"
        },
        "tags": [],
        "attributes": {
          "level": 1
        }
      }
    },
    {
      "external_id": "repogpt:cli_repo:sample.md:code_block:demo:1",
      "source_id": "repogpt:cli_repo:file:sample.md",
      "repo_key": "cli_repo",
      "scope": "repogpt:cli_repo",
      "snapshot_id": "<SNAPSHOT_ID>",
      "path": "sample.md",
      "language": "md",
      "unit_type": "code_block",
      "unit_level": "symbol",
      "symbol": null,
      "qualified_name": "demo/code_block[1]",
      "container_id": "repogpt:cli_repo:sample.md:heading:demo",
      "depth": 2,
      "ancestor_path": [
        "sample.md",
        "demo"
      ],
      "start_line": 7,
      "end_line": 9,
      "content": "```python\nprint(\"ok\")\n```\n",
      "content_hash": "cc888e6d1095f073cac7df83bf4d44ed6cf1744e0b7f54865a86ac5d95976c55",
      "docstring_present": false,
      "has_children": false,
      "metadata": {
        "file": {
          "size": 88,
          "sha256": "5a87f3df70d35798225f6704cd76e098ec06f4e69833e8a77054120456e5b79c"
        },
        "tags": [],
        "attributes": {
          "fence_language": "python"
        }
      }
    },
    {
      "external_id": "repogpt:cli_repo:sample.py:module",
      "source_id": "repogpt:cli_repo:file:sample.py",
      "repo_key": "cli_repo",
      "scope": "repogpt:cli_repo",
      "snapshot_id": "<SNAPSHOT_ID>",
      "path": "sample.py",
      "language": "py",
      "unit_type": "module",
      "unit_level": "container",
      "symbol": "sample",
      "qualified_name": "sample.py",
      "container_id": "repogpt:cli_repo:sample.py:module",
      "depth": 0,
      "ancestor_path": [],
      "start_line": 1,
      "end_line": 10,
      "content": "import os\n\n\n\n\n",
      "content_hash": "491ec8db853ced5739b2784b211db0c245d06ab823e21aa3ba7280b2eaa6fa61",
      "docstring_present": false,
      "has_children": true,
      "metadata": {
        "file": {
          "size": 144,
          "sha256": "774e76c0483e7970035e1e4ea43638b87dbef3fbd6c6b7a3b68289a6b4f76560"
        },
        "tags": [],
        "attributes": {}
      },
      "content_ranges": [
        {
          "start_line": 1,
          "end_line": 3
        },
        {
          "start_line": 7,
          "end_line": 8
        }
      ]
    },
    {
      "external_id": "repogpt:cli_repo:sample.py:class:Demo",
      "source_id": "repogpt:cli_repo:file:sample.py",
      "repo_key": "cli_repo",
      "scope": "repogpt:cli_repo",
      "snapshot_id": "<SNAPSHOT_ID>",
      "path": "sample.py",
      "language": "py",
      "unit_type": "class",
      "unit_level": "container",
      "symbol": "Demo",
      "qualified_name": "Demo",
      "container_id": "repogpt:cli_repo:sample.py:module",
      "depth": 1,
      "ancestor_path": [
        "sample.py"
      ],
      "start_line": 4,
      "end_line": 6,
      "content": "class Demo:\n    def method(self, value: int) -> int:\n        return value\n",
      "content_hash": "b4fe3e512675413a01b8b14f43c80963b0c38a9855afb311075cd609bf717795",
      "docstring_present": false,
      "has_children": true,
      "metadata": {
        "file": {
          "size": 144,
          "sha256": "774e76c0483e7970035e1e4ea43638b87dbef3fbd6c6b7a3b68289a6b4f76560"
        },
        "tags": [],
        "attributes": {
          "bases": [],
          "decorators": []
        }
      }
    },
    {
      "external_id": "repogpt:cli_repo:sample.py:method:Demo.method",
      "source_id": "repogpt:cli_repo:file:sample.py",
      "repo_key": "cli_repo",
      "scope": "repogpt:cli_repo",
      "snapshot_id": "<SNAPSHOT_ID>",
      "path": "sample.py",
      "language": "py",
      "unit_type": "method",
      "unit_level": "symbol",
      "symbol": "method",
      "qualified_name": "Demo.method",
      "container_id": "repogpt:cli_repo:sample.py:class:Demo",
      "depth": 2,
      "ancestor_path": [
        "sample.py",
        "Demo"
      ],
      "start_line": 5,
      "end_line": 6,
      "content": "    def method(self, value: int) -> int:\n        return value\n",
      "content_hash": "c16e938fe365e6eaf6a245d1fdfdc20baf10f3f59454beba70de669504ab027b",
      "docstring_present": false,
      "has_children": false,
      "metadata": {
        "file": {
          "size": 144,
          "sha256": "774e76c0483e7970035e1e4ea43638b87dbef3fbd6c6b7a3b68289a6b4f76560"
        },
        "tags": [],
        "attributes": {
          "is_async": false,
          "decorators": [],
          "params": [
            {
              "name": "self",
              "kind": "positional",
              "annotation": null,
              "default": null
            },
            {
              "name": "value",
              "kind": "positional",
              "annotation": "int",
              "default": null
            }
          ],
          "returns": "int",
          "visibility": "public",
          "signature": "method(self, value: int) -> int"
        }
      }
    },
    {
      "external_id": "repogpt:cli_repo:sample.py:function:helper",
      "source_id": "repogpt:cli_repo:file:sample.py",
      "repo_key": "cli_repo",
      "scope": "repogpt:cli_repo",
      "snapshot_id": "<SNAPSHOT_ID>",
      "path": "sample.py",
      "language": "py",
      "unit_type": "function",
      "unit_level": "symbol",
      "symbol": "helper",
      "qualified_name": "helper",
      "container_id": "repogpt:cli_repo:sample.py:module",
      "depth": 1,
      "ancestor_path": [
        "sample.py"
      ],
      "start_line": 9,
      "end_line": 10,
      "content": "def helper(name: str = \"world\") -> str:\n    return name\n",
      "content_hash": "d289ca7f09c9d375eaa4eff2ec00a5857958fb27f5c2845c7039ecee586907d2",
      "docstring_present": false,
      "has_children": false,
      "metadata": {
        "file": {
          "size": 144,
          "sha256": "774e76c0483e7970035e1e4ea43638b87dbef3fbd6c6b7a3b68289a6b4f76560"
        },
        "tags": [],
        "attributes": {
          "is_async": false,
          "decorators": [],
          "params": [
            {
              "name": "name",
              "kind": "positional",
              "annotation": "str",
              "default": "'world'"
            }
          ],
          "returns": "str",
          "visibility": "public",
          "signature": "helper(name: str='world') -> str"
        }
      }
    }
  ]
}
